entity_type,entity_id,doc_id,domain_id,lat,lon,canonical_name,streetName,landmarkToken,areaServed,lanternModel,locationCategory,powerState,status
streetlight,streetlight_000499,sl_000500,0,56.138744,10.213913,/d0/streetlight/sl_000500,"Queen Ave, North Harbor",North Harbor City Hall,North Harbor Financial Row,fluorescent,pedestrianPath,bootingUp,brokenLantern
streetlight,streetlight_000500,sl_000501,1,56.162509,10.245517,/d1/streetlight/sl_000501,"Tower Ln, Westside Heights",Westside Heights University Campus,Westside Heights Financial Row,LED,playground,on,ok
streetlight,streetlight_000501,sl_000502,5,56.148852,10.199316,/d5/streetlight/sl_000502,"Pine Rd, Lakeside District",Lakeside District Botanical Garden,Lakeside District Industrial Zone,HPS,road,off,defectiveLamp
streetlight,streetlight_000502,sl_000503,6,56.156424,10.155086,/d6/streetlight/sl_000503,"Pine Rd, Old Town Core",Old Town Core Historic Market,Old Town Core Financial Row,MH,sidewalk,low,columnIssue
streetlight,streetlight_000503,sl_000504,4,56.124015,10.166071,/d4/streetlight/sl_000504,"Bridge Ln, Midtown Center",Midtown Center City Hall,Midtown Center Residential Block,fluorescent,tunnel,bootingUp,brokenLantern
streetlight,streetlight_000504,sl_000505,7,56.179275,10.216915,/d7/streetlight/sl_000505,"Harbor Blvd, Greenfield Park",Greenfield Park Convention Center,Greenfield Park Uptown,LED,facade,on,ok
streetlight,streetlight_000505,sl_000506,2,56.181436,10.157863,/d2/streetlight/sl_000506,"Maple Blvd, Eastshore Quarter",Eastshore Quarter Main Station,Eastshore Quarter Commercial Strip,HPS,garden,off,defectiveLamp
streetlight,streetlight_000506,sl_000507,0,56.139638,10.201982,/d0/streetlight/sl_000507,"Valley Path, North Harbor",North Harbor Harbor Bridge,North Harbor Financial Row,MH,park,low,columnIssue
streetlight,streetlight_000507,sl_000508,7,56.188229,10.228785,/d7/streetlight/sl_000508,"Lake Dr, Greenfield Park",Greenfield Park Town Square,Greenfield Park Uptown,fluorescent,pedestrianPath,bootingUp,brokenLantern
streetlight,streetlight_000508,sl_000509,2,56.197242,10.172365,/d2/streetlight/sl_000509,"Gate St, Eastshore Quarter",Eastshore Quarter Convention Center,Eastshore Quarter Downtown,LED,playground,on,ok
streetlight,streetlight_000509,sl_000510,5,56.175151,10.212748,/d5/streetlight/sl_000510,"Maple Blvd, Lakeside District",Lakeside District Shopping Mall,Lakeside District Arts Quarter,HPS,road,off,defectiveLamp
streetlight,streetlight_000510,sl_000511,2,56.19201,10.162622,/d2/streetlight/sl_000511,"Pine Rd, Eastshore Quarter",Eastshore Quarter Lighthouse,Eastshore Quarter Civic Center,MH,sidewalk,low,columnIssue
streetlight,streetlight_000511,sl_000512,2,56.191588,10.166367,/d2/streetlight/sl_000512,"Maple Blvd, Eastshore Quarter",Eastshore Quarter Science Center,Eastshore Quarter Transit Hub,fluorescent,tunnel,bootingUp,brokenLantern
streetlight,streetlight_000512,sl_000513,7,56.19989,10.201082,/d7/streetlight/sl_000513,"Queen Ave, Greenfield Park",Greenfield Park Harbor Bridge,Greenfield Park Financial Row,LED,facade,on,ok
streetlight,streetlight_000513,sl_000514,5,56.143564,10.211155,/d5/streetlight/sl_000514,"Spruce St, Lakeside District",Lakeside District University Campus,Lakeside District Civic Center,HPS,garden,off,defectiveLamp
streetlight,streetlight_000514,sl_000515,7,56.178493,10.179823,/d7/streetlight/sl_000515,"Ash Ct, Greenfield Park",Greenfield Park City Library,Greenfield Park Downtown,MH,park,low,columnIssue
streetlight,streetlight_000515,sl_000516,7,56.197425,10.224942,/d7/streetlight/sl_000516,"Market Rd, Greenfield Park",Greenfield Park Harbor Bridge,Greenfield Park Commercial Strip,fluorescent,pedestrianPath,bootingUp,brokenLantern
streetlight,streetlight_000516,sl_000517,0,56.136849,10.190963,/d0/streetlight/sl_000517,"Birch Dr, North Harbor",North Harbor Cathedral,North Harbor Industrial Zone,LED,playground,on,ok
streetlight,streetlight_000517,sl_000518,6,56.147172,10.161722,/d6/streetlight/sl_000518,"Cherry Ln, Old Town Core",Old Town Core Shopping Mall,Old Town Core Waterfront,HPS,road,off,defectiveLamp
streetlight,streetlight_000518,sl_000519,1,56.191193,10.249336,/d1/streetlight/sl_000519,"Spruce St, Westside Heights",Westside Heights Riverside Park,Westside Heights Commercial Strip,MH,sidewalk,low,columnIssue
streetlight,streetlight_000519,sl_000520,7,56.179054,10.190932,/d7/streetlight/sl_000520,"School St, Greenfield Park",Greenfield Park Shopping Mall,Greenfield Park Arts Quarter,fluorescent,tunnel,bootingUp,brokenLantern
streetlight,streetlight_000520,sl_000521,1,56.172225,10.237711,/d1/streetlight/sl_000521,"Gate St, Westside Heights",Westside Heights City Library,Westside Heights Civic Center,LED,facade,on,ok
streetlight,streetlight_000521,sl_000522,5,56.167785,10.208852,/d5/streetlight/sl_000522,"Oak Ave, Lakeside District",Lakeside District Cultural Center,Lakeside District Financial Row,HPS,garden,off,defectiveLamp
streetlight,streetlight_000522,sl_000523,5,56.171667,10.217253,/d5/streetlight/sl_000523,"Canal St, Lakeside District",Lakeside District University Campus,Lakeside District Uptown,MH,park,low,columnIssue
streetlight,streetlight_000523,sl_000524,7,56.195395,10.209638,/d7/streetlight/sl_000524,"King Blvd, Greenfield Park",Greenfield Park Lighthouse,Greenfield Park Uptown,fluorescent,pedestrianPath,bootingUp,brokenLantern
streetlight,streetlight_000524,sl_000525,5,56.174141,10.204225,/d5/streetlight/sl_000525,"Willow Way, Lakeside District",Lakeside District Convention Center,Lakeside District Downtown,LED,playground,on,ok
streetlight,streetlight_000525,sl_000526,1,56.183395,10.23797,/d1/streetlight/sl_000526,"Lake Dr, Westside Heights",Westside Heights Harbor Bridge,Westside Heights Waterfront,HPS,road,off,defectiveLamp
streetlight,streetlight_000526,sl_000527,0,56.14206,10.193235,/d0/streetlight/sl_000527,"Forest Ave, North Harbor",North Harbor Botanical Garden,North Harbor Commercial Strip,MH,sidewalk,low,columnIssue
streetlight,streetlight_000527,sl_000528,2,56.189335,10.174584,/d2/streetlight/sl_000528,"Queen Ave, Eastshore Quarter",Eastshore Quarter Central Plaza,Eastshore Quarter Financial Row,fluorescent,tunnel,bootingUp,brokenLantern
streetlight,streetlight_000528,sl_000529,6,56.162404,10.173726,/d6/streetlight/sl_000529,"Tower Ln, Old Town Core",Old Town Core University Campus,Old Town Core Financial Row,LED,facade,on,ok
streetlight,streetlight_000529,sl_000530,1,56.150609,10.233474,/d1/streetlight/sl_000530,"Market Rd, Westside Heights",Westside Heights Lighthouse,Westside Heights Financial Row,HPS,garden,off,defectiveLamp
streetlight,streetlight_000530,sl_000531,0,56.120224,10.196734,/d0/streetlight/sl_000531,"Station Rd, North Harbor",North Harbor Riverside Park,North Harbor Waterfront,MH,park,low,columnIssue
streetlight,streetlight_000531,sl_000532,7,56.197466,10.235392,/d7/streetlight/sl_000532,"King Blvd, Greenfield Park",Greenfield Park Clock Tower,Greenfield Park Downtown,fluorescent,pedestrianPath,bootingUp,brokenLantern
streetlight,streetlight_000532,sl_000533,5,56.145509,10.216207,/d5/streetlight/sl_000533,"Elm St, Lakeside District",Lakeside District Riverside Park,Lakeside District Waterfront,LED,playground,on,ok
streetlight,streetlight_000533,sl_000534,0,56.134654,10.20795,/d0/streetlight/sl_000534,"Ash Ct, North Harbor",North Harbor Cathedral,North Harbor Transit Hub,HPS,road,off,defectiveLamp
streetlight,streetlight_000534,sl_000535,1,56.147708,10.223871,/d1/streetlight/sl_000535,"Spruce St, Westside Heights",Westside Heights University Campus,Westside Heights Arts Quarter,MH,sidewalk,low,columnIssue
streetlight,streetlight_000535,sl_000536,6,56.157565,10.162772,/d6/streetlight/sl_000536,"Ash Ct, Old Town Core",Old Town Core Cultural Center,Old Town Core Transit Hub,fluorescent,tunnel,bootingUp,brokenLantern
streetlight,streetlight_000536,sl_000537,6,56.172823,10.157079,/d6/streetlight/sl_000537,"Tower Ln, Old Town Core",Old Town Core Central Plaza,Old Town Core Residential Block,LED,facade,on,ok
streetlight,streetlight_000537,sl_000538,5,56.149015,10.188746,/d5/streetlight/sl_000538,"Lake Dr, Lakeside District",Lakeside District Cathedral,Lakeside District Arts Quarter,HPS,garden,off,defectiveLamp
streetlight,streetlight_000538,sl_000539,2,56.18555,10.167883,/d2/streetlight/sl_000539,"Church Ln, Eastshore Quarter",Eastshore Quarter City Hall,Eastshore Quarter Financial Row,MH,park,low,columnIssue
streetlight,streetlight_000539,sl_000540,6,56.147188,10.150461,/d6/streetlight/sl_000540,"Park Rd, Old Town Core",Old Town Core Cathedral,Old Town Core Downtown,fluorescent,pedestrianPath,bootingUp,brokenLantern
streetlight,streetlight_000540,sl_000541,6,56.152533,10.165012,/d6/streetlight/sl_000541,"Station Rd, Old Town Core",Old Town Core Botanical Garden,Old Town Core Commercial Strip,LED,playground,on,ok
streetlight,streetlight_000541,sl_000542,1,56.151388,10.242108,/d1/streetlight/sl_000542,"Market Rd, Westside Heights",Westside Heights Cathedral,Westside Heights Financial Row,HPS,road,off,defectiveLamp
streetlight,streetlight_000542,sl_000543,1,56.155673,10.239795,/d1/streetlight/sl_000543,"King Blvd, Westside Heights",Westside Heights Cathedral,Westside Heights Downtown,MH,sidewalk,low,columnIssue
streetlight,streetlight_000543,sl_000544,1,56.175713,10.249438,/d1/streetlight/sl_000544,"Ash Ct, Westside Heights",Westside Heights Botanical Garden,Westside Heights Waterfront,fluorescent,tunnel,bootingUp,brokenLantern
streetlight,streetlight_000544,sl_000545,1,56.153875,10.231754,/d1/streetlight/sl_000545,"Canal St, Westside Heights",Westside Heights Waterfront Promenade,Westside Heights Uptown,LED,facade,on,ok
streetlight,streetlight_000545,sl_000546,1,56.170352,10.223353,/d1/streetlight/sl_000546,"Station Rd, Westside Heights",Westside Heights Convention Center,Westside Heights Transit Hub,HPS,garden,off,defectiveLamp
streetlight,streetlight_000546,sl_000547,5,56.160174,10.197695,/d5/streetlight/sl_000547,"Cherry Ln, Lakeside District",Lakeside District Science Center,Lakeside District Downtown,MH,park,low,columnIssue
streetlight,streetlight_000547,sl_000548,1,56.190215,10.242686,/d1/streetlight/sl_000548,"King Blvd, Westside Heights",Westside Heights Historic Market,Westside Heights Arts Quarter,fluorescent,pedestrianPath,bootingUp,brokenLantern
streetlight,streetlight_000548,sl_000549,1,56.182136,10.247555,/d1/streetlight/sl_000549,"Oak Ave, Westside Heights",Westside Heights City Hall,Westside Heights Waterfront,LED,playground,on,ok
streetlight,streetlight_000549,sl_000550,7,56.181263,10.180618,/d7/streetlight/sl_000550,"Spruce St, Greenfield Park",Greenfield Park Shopping Mall,Greenfield Park Uptown,HPS,road,off,defectiveLamp
streetlight,streetlight_000550,sl_000551,5,56.142876,10.180454,/d5/streetlight/sl_000551,"River Rd, Lakeside District",Lakeside District Waterfront Promenade,Lakeside District Waterfront,MH,sidewalk,low,columnIssue
streetlight,streetlight_000551,sl_000552,4,56.135228,10.159041,/d4/streetlight/sl_000552,"Ash Ct, Midtown Center",Midtown Center Riverside Park,Midtown Center Waterfront,fluorescent,tunnel,bootingUp,brokenLantern
streetlight,streetlight_000552,sl_000553,0,56.141264,10.209001,/d0/streetlight/sl_000553,"Valley Path, North Harbor",North Harbor Harbor Bridge,North Harbor Downtown,LED,facade,on,ok
streetlight,streetlight_000553,sl_000554,1,56.177882,10.223363,/d1/streetlight/sl_000554,"Station Rd, Westside Heights",Westside Heights City Library,Westside Heights Downtown,HPS,garden,off,defectiveLamp
streetlight,streetlight_000554,sl_000555,3,56.127201,10.231764,/d3/streetlight/sl_000555,"Maple Blvd, South Hills",South Hills Botanical Garden,South Hills Commercial Strip,MH,park,low,columnIssue
streetlight,streetlight_000555,sl_000556,0,56.135721,10.209463,/d0/streetlight/sl_000556,"Birch Dr, North Harbor",North Harbor Waterfront Promenade,North Harbor Residential Block,fluorescent,pedestrianPath,bootingUp,brokenLantern
streetlight,streetlight_000556,sl_000557,6,56.166825,10.168147,/d6/streetlight/sl_000557,"Market Rd, Old Town Core",Old Town Core Botanical Garden,Old Town Core Waterfront,LED,playground,on,ok
streetlight,streetlight_000557,sl_000558,0,56.120151,10.181586,/d0/streetlight/sl_000558,"Market Rd, North Harbor",North Harbor Main Station,North Harbor Transit Hub,HPS,road,off,defectiveLamp
streetlight,streetlight_000558,sl_000559,7,56.186856,10.197725,/d7/streetlight/sl_000559,"Summit Way, Greenfield Park",Greenfield Park Clock Tower,Greenfield Park Arts Quarter,MH,sidewalk,low,columnIssue
streetlight,streetlight_000559,sl_000560,1,56.147789,10.239608,/d1/streetlight/sl_000560,"Willow Way, Westside Heights",Westside Heights Main Station,Westside Heights Industrial Zone,fluorescent,tunnel,bootingUp,brokenLantern
streetlight,streetlight_000560,sl_000561,4,56.121591,10.174457,/d4/streetlight/sl_000561,"Oak Ave, Midtown Center",Midtown Center Botanical Garden,Midtown Center Financial Row,LED,facade,on,ok
streetlight,streetlight_000561,sl_000562,3,56.140169,10.239547,/d3/streetlight/sl_000562,"School St, South Hills",South Hills Central Plaza,South Hills Downtown,HPS,garden,off,defectiveLamp
streetlight,streetlight_000562,sl_000563,7,56.196365,10.20067,/d7/streetlight/sl_000563,"Elm St, Greenfield Park",Greenfield Park City Library,Greenfield Park Arts Quarter,MH,park,low,columnIssue
streetlight,streetlight_000563,sl_000564,0,56.128402,10.193319,/d0/streetlight/sl_000564,"Cherry Ln, North Harbor",North Harbor Sports Arena,North Harbor Civic Center,fluorescent,pedestrianPath,bootingUp,brokenLantern
streetlight,streetlight_000564,sl_000565,0,56.130032,10.189185,/d0/streetlight/sl_000565,"Gate St, North Harbor",North Harbor Historic Market,North Harbor Arts Quarter,LED,playground,on,ok
streetlight,streetlight_000565,sl_000566,3,56.121299,10.223245,/d3/streetlight/sl_000566,"Queen Ave, South Hills",South Hills Art Museum,South Hills Waterfront,HPS,road,off,defectiveLamp
streetlight,streetlight_000566,sl_000567,1,56.171693,10.228207,/d1/streetlight/sl_000567,"Oak Ave, Westside Heights",Westside Heights Clock Tower,Westside Heights Commercial Strip,MH,sidewalk,low,columnIssue
streetlight,streetlight_000567,sl_000568,4,56.123069,10.154482,/d4/streetlight/sl_000568,"Valley Path, Midtown Center",Midtown Center City Hall,Midtown Center Industrial Zone,fluorescent,tunnel,bootingUp,brokenLantern
streetlight,streetlight_000568,sl_000569,0,56.134876,10.214582,/d0/streetlight/sl_000569,"Summit Way, North Harbor",North Harbor City Library,North Harbor Financial Row,LED,facade,on,ok
streetlight,streetlight_000569,sl_000570,7,56.183632,10.185097,/d7/streetlight/sl_000570,"Cedar Ln, Greenfield Park",Greenfield Park Convention Center,Greenfield Park Civic Center,HPS,garden,off,defectiveLamp
streetlight,streetlight_000570,sl_000571,2,56.186411,10.165423,/d2/streetlight/sl_000571,"Church Ln, Eastshore Quarter",Eastshore Quarter Cathedral,Eastshore Quarter Downtown,MH,park,low,columnIssue
streetlight,streetlight_000571,sl_000572,5,56.163363,10.199548,/d5/streetlight/sl_000572,"Pine Rd, Lakeside District",Lakeside District Central Plaza,Lakeside District Residential Block,fluorescent,pedestrianPath,bootingUp,brokenLantern
streetlight,streetlight_000572,sl_000573,3,56.14068,10.247736,/d3/streetlight/sl_000573,"Market Rd, South Hills",South Hills Sports Arena,South Hills Residential Block,LED,playground,on,ok
streetlight,streetlight_000573,sl_000574,3,56.124513,10.232938,/d3/streetlight/sl_000574,"Gate St, South Hills",South Hills Town Square,South Hills Industrial Zone,HPS,road,off,defectiveLamp
streetlight,streetlight_000574,sl_000575,4,56.126144,10.160166,/d4/streetlight/sl_000575,"Castle Rd, Midtown Center",Midtown Center Central Plaza,Midtown Center Downtown,MH,sidewalk,low,columnIssue
streetlight,streetlight_000575,sl_000576,5,56.160686,10.214337,/d5/streetlight/sl_000576,"Lake Dr, Lakeside District",Lakeside District Harbor Bridge,Lakeside District Financial Row,fluorescent,tunnel,bootingUp,brokenLantern
streetlight,streetlight_000576,sl_000577,1,56.163415,10.245461,/d1/streetlight/sl_000577,"Summit Way, Westside Heights",Westside Heights Shopping Mall,Westside Heights Downtown,LED,facade,on,ok
streetlight,streetlight_000577,sl_000578,2,56.194761,10.15618,/d2/streetlight/sl_000578,"Willow Way, Eastshore Quarter",Eastshore Quarter Cultural Center,Eastshore Quarter Arts Quarter,HPS,garden,off,defectiveLamp
streetlight,streetlight_000578,sl_000579,0,56.139161,10.194113,/d0/streetlight/sl_000579,"Park Rd, North Harbor",North Harbor Riverside Park,North Harbor Civic Center,MH,park,low,columnIssue
streetlight,streetlight_000579,sl_000580,6,56.166193,10.153067,/d6/streetlight/sl_000580,"Maple Blvd, Old Town Core",Old Town Core University Campus,Old Town Core Waterfront,fluorescent,pedestrianPath,bootingUp,brokenLantern
streetlight,streetlight_000580,sl_000581,0,56.124764,10.189732,/d0/streetlight/sl_000581,"Valley Path, North Harbor",North Harbor Waterfront Promenade,North Harbor Transit Hub,LED,playground,on,ok
streetlight,streetlight_000581,sl_000582,5,56.160528,10.21461,/d5/streetlight/sl_000582,"Church Ln, Lakeside District",Lakeside District Waterfront Promenade,Lakeside District Residential Block,HPS,road,off,defectiveLamp
streetlight,streetlight_000582,sl_000583,1,56.153888,10.245905,/d1/streetlight/sl_000583,"Church Ln, Westside Heights",Westside Heights Botanical Garden,Westside Heights Arts Quarter,MH,sidewalk,low,columnIssue
streetlight,streetlight_000583,sl_000584,3,56.134716,10.226145,/d3/streetlight/sl_000584,"King Blvd, South Hills",South Hills Science Center,South Hills Industrial Zone,fluorescent,tunnel,bootingUp,brokenLantern
streetlight,streetlight_000584,sl_000585,3,56.12754,10.247853,/d3/streetlight/sl_000585,"Birch Dr, South Hills",South Hills Convention Center,South Hills Transit Hub,LED,facade,on,ok
streetlight,streetlight_000585,sl_000586,7,56.192421,10.177931,/d7/streetlight/sl_000586,"Castle Rd, Greenfield Park",Greenfield Park Shopping Mall,Greenfield Park Civic Center,HPS,garden,off,defectiveLamp
streetlight,streetlight_000586,sl_000587,6,56.173222,10.16211,/d6/streetlight/sl_000587,"Cedar Ln, Old Town Core",Old Town Core Art Museum,Old Town Core Financial Row,MH,park,low,columnIssue
streetlight,streetlight_000587,sl_000588,7,56.191057,10.221456,/d7/streetlight/sl_000588,"King Blvd, Greenfield Park",Greenfield Park Convention Center,Greenfield Park Industrial Zone,fluorescent,pedestrianPath,bootingUp,brokenLantern
streetlight,streetlight_000588,sl_000589,6,56.154768,10.169803,/d6/streetlight/sl_000589,"Valley Path, Old Town Core",Old Town Core Cathedral,Old Town Core Waterfront,LED,playground,on,ok
streetlight,streetlight_000589,sl_000590,2,56.193848,10.154076,/d2/streetlight/sl_000590,"Forest Ave, Eastshore Quarter",Eastshore Quarter Main Station,Eastshore Quarter Transit Hub,HPS,road,off,defectiveLamp
streetlight,streetlight_000590,sl_000591,0,56.127862,10.200947,/d0/streetlight/sl_000591,"Castle Rd, North Harbor",North Harbor Main Station,North Harbor Downtown,MH,sidewalk,low,columnIssue
streetlight,streetlight_000591,sl_000592,5,56.155743,10.216917,/d5/streetlight/sl_000592,"Birch Dr, Lakeside District",Lakeside District University Campus,Lakeside District Civic Center,fluorescent,tunnel,bootingUp,brokenLantern
streetlight,streetlight_000592,sl_000593,2,56.188281,10.173059,/d2/streetlight/sl_000593,"Canal St, Eastshore Quarter",Eastshore Quarter Convention Center,Eastshore Quarter Downtown,LED,facade,on,ok
streetlight,streetlight_000593,sl_000594,0,56.137015,10.193185,/d0/streetlight/sl_000594,"Willow Way, North Harbor",North Harbor Cathedral,North Harbor Arts Quarter,HPS,garden,off,defectiveLamp
streetlight,streetlight_000594,sl_000595,1,56.176114,10.228863,/d1/streetlight/sl_000595,"School St, Westside Heights",Westside Heights Science Center,Westside Heights Financial Row,MH,park,low,columnIssue
streetlight,streetlight_000595,sl_000596,2,56.195864,10.169198,/d2/streetlight/sl_000596,"Elm St, Eastshore Quarter",Eastshore Quarter Cathedral,Eastshore Quarter Industrial Zone,fluorescent,pedestrianPath,bootingUp,brokenLantern
streetlight,streetlight_000596,sl_000597,7,56.189427,10.20507,/d7/streetlight/sl_000597,"Spruce St, Greenfield Park",Greenfield Park Town Square,Greenfield Park Industrial Zone,LED,playground,on,ok
streetlight,streetlight_000597,sl_000598,4,56.126002,10.152896,/d4/streetlight/sl_000598,"Canal St, Midtown Center",Midtown Center Cultural Center,Midtown Center Waterfront,HPS,road,off,defectiveLamp
streetlight,streetlight_000598,sl_000599,0,56.139309,10.221474,/d0/streetlight/sl_000599,"Willow Way, North Harbor",North Harbor Clock Tower,North Harbor Waterfront,MH,sidewalk,low,columnIssue
streetlight,streetlight_000599,sl_000600,1,56.171559,10.240108,/d1/streetlight/sl_000600,"Spruce St, Westside Heights",Westside Heights Harbor Bridge,Westside Heights Industrial Zone,fluorescent,tunnel,bootingUp,brokenLantern
parking,parking_000000,p_000001,3,56.174633,10.17792,/d3/parking/p_000001,"Birch Dr, South Hills",South Hills City Hall,South Hills Financial Row,,,,
parking,parking_000001,p_000002,4,56.186679,10.21499,/d4/parking/p_000002,"Station Rd, Midtown Center",Midtown Center Waterfront Promenade,Midtown Center Uptown,,,,
parking,parking_000002,p_000003,6,56.152802,10.163784,/d6/parking/p_000003,"Spruce St, Old Town Core",Old Town Core City Library,Old Town Core Uptown,,,,
parking,parking_000003,p_000004,0,56.138592,10.182011,/d0/parking/p_000004,"Church Ln, North Harbor",North Harbor Sports Arena,North Harbor Uptown,,,,
parking,parking_000004,p_000005,6,56.170668,10.157545,/d6/parking/p_000005,"Castle Rd, Old Town Core",Old Town Core Waterfront Promenade,Old Town Core Financial Row,,,,
parking,parking_000005,p_000006,4,56.190918,10.186219,/d4/parking/p_000006,"Pine Rd, Midtown Center",Midtown Center Historic Market,Midtown Center Uptown,,,,
parking,parking_000006,p_000007,0,56.138423,10.200621,/d0/parking/p_000007,"School St, North Harbor",North Harbor Clock Tower,North Harbor Uptown,,,,
parking,parking_000007,p_000008,0,56.123178,10.199721,/d0/parking/p_000008,"Bridge Ln, North Harbor",North Harbor Clock Tower,North Harbor Uptown,,,,
parking,parking_000008,p_000009,0,56.13648,10.181519,/d0/parking/p_000009,"Summit Way, North Harbor",North Harbor Shopping Mall,North Harbor Transit Hub,,,,
parking,parking_000009,p_000010,4,56.137305,10.166146,/d4/parking/p_000010,"Gate St, Midtown Center",Midtown Center City Library,Midtown Center Financial Row,,,,
parking,parking_000010,p_000011,3,56.165656,10.216418,/d3/parking/p_000011,"Gate St, South Hills",South Hills Cultural Center,South Hills Downtown,,,,
parking,parking_000011,p_000012,2,56.196278,10.172849,/d2/parking/p_000012,"Maple Blvd, Eastshore Quarter",Eastshore Quarter Waterfront Promenade,Eastshore Quarter Industrial Zone,,,,
parking,parking_000012,p_000013,3,56.151441,10.226642,/d3/parking/p_000013,"Castle Rd, South Hills",South Hills Cathedral,South Hills Industrial Zone,,,,
parking,parking_000013,p_000014,4,56.146968,10.214316,/d4/parking/p_000014,"Gate St, Midtown Center",Midtown Center Sports Arena,Midtown Center Transit Hub,,,,
parking,parking_000014,p_000015,2,56.199215,10.170178,/d2/parking/p_000015,"Castle Rd, Eastshore Quarter",Eastshore Quarter University Campus,Eastshore Quarter Commercial Strip,,,,
parking,parking_000015,p_000016,3,56.133975,10.240994,/d3/parking/p_000016,"Willow Way, South Hills",South Hills Cultural Center,South Hills Financial Row,,,,
parking,parking_000016,p_000017,4,56.139883,10.150864,/d4/parking/p_000017,"Forest Ave, Midtown Center",Midtown Center Historic Market,Midtown Center Residential Block,,,,
parking,parking_000017,p_000018,4,56.17304,10.226294,/d4/parking/p_000018,"Forest Ave, Midtown Center",Midtown Center Central Plaza,Midtown Center Downtown,,,,
parking,parking_000018,p_000019,4,56.155317,10.235085,/d4/parking/p_000019,"Summit Way, Midtown Center",Midtown Center University Campus,Midtown Center Financial Row,,,,
parking,parking_000019,p_000020,4,56.194976,10.233865,/d4/parking/p_000020,"Oak Ave, Midtown Center",Midtown Center Waterfront Promenade,Midtown Center Uptown,,,,
parking,parking_000020,p_000021,4,56.145506,10.19044,/d4/parking/p_000021,"Canal St, Midtown Center",Midtown Center City Library,Midtown Center Industrial Zone,,,,
parking,parking_000021,p_000022,2,56.180038,10.164774,/d2/parking/p_000022,"Cherry Ln, Eastshore Quarter",Eastshore Quarter Harbor Bridge,Eastshore Quarter Commercial Strip,,,,
parking,parking_000022,p_000023,6,56.16328,10.153246,/d6/parking/p_000023,"Cedar Ln, Old Town Core",Old Town Core City Hall,Old Town Core Uptown,,,,
parking,parking_000023,p_000024,0,56.13448,10.208716,/d0/parking/p_000024,"Summit Way, North Harbor",North Harbor Science Center,North Harbor Arts Quarter,,,,
parking,parking_000024,p_000025,0,56.140025,10.191406,/d0/parking/p_000025,"Garden St, North Harbor",North Harbor Historic Market,North Harbor Civic Center,,,,
parking,parking_000025,p_000026,4,56.195807,10.241882,/d4/parking/p_000026,"Castle Rd, Midtown Center",Midtown Center City Hall,Midtown Center Financial Row,,,,
parking,parking_000026,p_000027,4,56.151557,10.197587,/d4/parking/p_000027,"Canal St, Midtown Center",Midtown Center Art Museum,Midtown Center Transit Hub,,,,
parking,parking_000027,p_000028,4,56.161851,10.221089,/d4/parking/p_000028,"Forest Ave, Midtown Center",Midtown Center Town Square,Midtown Center Waterfront,,,,
parking,parking_000028,p_000029,6,56.165973,10.162036,/d6/parking/p_000029,"Valley Path, Old Town Core",Old Town Core Waterfront Promenade,Old Town Core Arts Quarter,,,,
parking,parking_000029,p_000030,2,56.19586,10.156845,/d2/parking/p_000030,"Maple Blvd, Eastshore Quarter",Eastshore Quarter University Campus,Eastshore Quarter Industrial Zone,,,,
