entity_type,entity_id,doc_id,domain_id,lat,lon,canonical_name,streetName,landmarkToken,areaServed,lanternModel,locationCategory,powerState,status
traffic,traffic_000047,traf_000048,4,56.126492,10.160245,/d4/traffic/traf_000048,"Lake Dr, Midtown Center",Midtown Center Convention Center,Midtown Center Industrial Zone,,,,
traffic,traffic_000048,traf_000049,4,56.131525,10.164537,/d4/traffic/traf_000049,"Ash Ct, Midtown Center",Midtown Center Harbor Bridge,Midtown Center Waterfront,,,,
traffic,traffic_000049,traf_000050,1,56.167018,10.228084,/d1/traffic/traf_000050,"Lake Dr, Westside Heights",Westside Heights Harbor Bridge,Westside Heights Industrial Zone,,,,
traffic,traffic_000050,traf_000051,4,56.124987,10.177066,/d4/traffic/traf_000051,"Tower Ln, Midtown Center",Midtown Center City Library,Midtown Center Waterfront,,,,
traffic,traffic_000051,traf_000052,2,56.171493,10.215894,/d2/traffic/traf_000052,"Forest Ave, Eastshore Quarter",Eastshore Quarter Harbor Bridge,Eastshore Quarter Residential Block,,,,
traffic,traffic_000052,traf_000053,6,56.177053,10.163831,/d6/traffic/traf_000053,"Oak Ave, Old Town Core",Old Town Core City Library,Old Town Core Waterfront,,,,
traffic,traffic_000053,traf_000054,4,56.130632,10.154595,/d4/traffic/traf_000054,"Bridge Ln, Midtown Center",Midtown Center Town Square,Midtown Center Financial Row,,,,
traffic,traffic_000054,traf_000055,4,56.170414,10.209608,/d4/traffic/traf_000055,"Tower Ln, Midtown Center",Midtown Center Town Square,Midtown Center Industrial Zone,,,,
traffic,traffic_000055,traf_000056,2,56.183209,10.173373,/d2/traffic/traf_000056,"Spruce St, Eastshore Quarter",Eastshore Quarter Cathedral,Eastshore Quarter Commercial Strip,,,,
traffic,traffic_000056,traf_000057,7,56.18481,10.215293,/d7/traffic/traf_000057,"Willow Way, Greenfield Park",Greenfield Park Riverside Park,Greenfield Park Uptown,,,,
traffic,traffic_000057,traf_000058,4,56.155827,10.214747,/d4/traffic/traf_000058,"Maple Blvd, Midtown Center",Midtown Center University Campus,Midtown Center Uptown,,,,
traffic,traffic_000058,traf_000059,6,56.163446,10.176936,/d6/traffic/traf_000059,"Garden St, Old Town Core",Old Town Core Convention Center,Old Town Core Downtown,,,,
traffic,traffic_000059,traf_000060,2,56.196476,10.173142,/d2/traffic/traf_000060,"Pine Rd, Eastshore Quarter",Eastshore Quarter Waterfront Promenade,Eastshore Quarter Commercial Strip,,,,
traffic,traffic_000060,traf_000061,1,56.183009,10.243636,/d1/traffic/traf_000061,"Cedar Ln, Westside Heights",Westside Heights Cultural Center,Westside Heights Uptown,,,,
traffic,traffic_000061,traf_000062,7,56.182009,10.200187,/d7/traffic/traf_000062,"Bridge Ln, Greenfield Park",Greenfield Park Cathedral,Greenfield Park Waterfront,,,,
traffic,traffic_000062,traf_000063,6,56.148414,10.170742,/d6/traffic/traf_000063,"Gate St, Old Town Core",Old Town Core Art Museum,Old Town Core Financial Row,,,,
traffic,traffic_000063,traf_000064,0,56.13144,10.205499,/d0/traffic/traf_000064,"Valley Path, North Harbor",North Harbor Historic Market,North Harbor Residential Block,,,,
traffic,traffic_000064,traf_000065,4,56.124845,10.171834,/d4/traffic/traf_000065,"Park Rd, Midtown Center",Midtown Center Central Plaza,Midtown Center Industrial Zone,,,,
traffic,traffic_000065,traf_000066,7,56.199083,10.239245,/d7/traffic/traf_000066,"King Blvd, Greenfield Park",Greenfield Park Clock Tower,Greenfield Park Waterfront,,,,
traffic,traffic_000066,traf_000067,6,56.162593,10.161046,/d6/traffic/traf_000067,"Valley Path, Old Town Core",Old Town Core City Library,Old Town Core Arts Quarter,,,,
traffic,traffic_000067,traf_000068,4,56.135986,10.163858,/d4/traffic/traf_000068,"Canal St, Midtown Center",Midtown Center Town Square,Midtown Center Waterfront,,,,
traffic,traffic_000068,traf_000069,2,56.188691,10.159796,/d2/traffic/traf_000069,"Oak Ave, Eastshore Quarter",Eastshore Quarter Art Museum,Eastshore Quarter Arts Quarter,,,,
traffic,traffic_000069,traf_000070,1,56.188601,10.2452,/d1/traffic/traf_000070,"Park Rd, Westside Heights",Westside Heights Riverside Park,Westside Heights Downtown,,,,
traffic,traffic_000070,traf_000071,1,56.159646,10.231198,/d1/traffic/traf_000071,"Spruce St, Westside Heights",Westside Heights Art Museum,Westside Heights Civic Center,,,,
traffic,traffic_000071,traf_000072,2,56.188688,10.159876,/d2/traffic/traf_000072,"Spruce St, Eastshore Quarter",Eastshore Quarter Riverside Park,Eastshore Quarter Uptown,,,,
traffic,traffic_000072,traf_000073,4,56.143455,10.186982,/d4/traffic/traf_000073,"Canal St, Midtown Center",Midtown Center Lighthouse,Midtown Center Industrial Zone,,,,
traffic,traffic_000073,traf_000074,7,56.183001,10.219072,/d7/traffic/traf_000074,"Lake Dr, Greenfield Park",Greenfield Park Main Station,Greenfield Park Financial Row,,,,
traffic,traffic_000074,traf_000075,6,56.146985,10.165298,/d6/traffic/traf_000075,"Canal St, Old Town Core",Old Town Core Historic Market,Old Town Core Industrial Zone,,,,
traffic,traffic_000075,traf_000076,4,56.152238,10.19813,/d4/traffic/traf_000076,"Bridge Ln, Midtown Center",Midtown Center University Campus,Midtown Center Waterfront,,,,
traffic,traffic_000076,traf_000077,6,56.151662,10.156343,/d6/traffic/traf_000077,"Garden St, Old Town Core",Old Town Core Art Museum,Old Town Core Financial Row,,,,
traffic,traffic_000077,traf_000078,3,56.120541,10.236694,/d3/traffic/traf_000078,"Mill Rd, South Hills",South Hills Riverside Park,South Hills Uptown,,,,
traffic,traffic_000078,traf_000079,4,56.150124,10.198998,/d4/traffic/traf_000079,"Cedar Ln, Midtown Center",Midtown Center Shopping Mall,Midtown Center Commercial Strip,,,,
traffic,traffic_000079,traf_000080,7,56.19243,10.209292,/d7/traffic/traf_000080,"School St, Greenfield Park",Greenfield Park Sports Arena,Greenfield Park Arts Quarter,,,,
traffic,traffic_000080,traf_000081,7,56.186717,10.220296,/d7/traffic/traf_000081,"Park Rd, Greenfield Park",Greenfield Park Art Museum,Greenfield Park Residential Block,,,,
traffic,traffic_000081,traf_000082,0,56.120765,10.179622,/d0/traffic/traf_000082,"Queen Ave, North Harbor",North Harbor Sports Arena,North Harbor Transit Hub,,,,
traffic,traffic_000082,traf_000083,2,56.189417,10.172237,/d2/traffic/traf_000083,"Castle Rd, Eastshore Quarter",Eastshore Quarter Cultural Center,Eastshore Quarter Transit Hub,,,,
traffic,traffic_000083,traf_000084,3,56.131666,10.226565,/d3/traffic/traf_000084,"Oak Ave, South Hills",South Hills Clock Tower,South Hills Commercial Strip,,,,
traffic,traffic_000084,traf_000085,0,56.125469,10.186693,/d0/traffic/traf_000085,"Forest Ave, North Harbor",North Harbor Harbor Bridge,North Harbor Residential Block,,,,
traffic,traffic_000085,traf_000086,4,56.16419,10.208429,/d4/traffic/traf_000086,"Birch Dr, Midtown Center",Midtown Center Botanical Garden,Midtown Center Financial Row,,,,
traffic,traffic_000086,traf_000087,7,56.183828,10.201998,/d7/traffic/traf_000087,"Oak Ave, Greenfield Park",Greenfield Park Cathedral,Greenfield Park Civic Center,,,,
traffic,traffic_000087,traf_000088,4,56.163734,10.183661,/d4/traffic/traf_000088,"Lake Dr, Midtown Center",Midtown Center Waterfront Promenade,Midtown Center Industrial Zone,,,,
traffic,traffic_000088,traf_000089,5,56.175428,10.180143,/d5/traffic/traf_000089,"Gate St, Lakeside District",Lakeside District Sports Arena,Lakeside District Uptown,,,,
traffic,traffic_000089,traf_000090,1,56.191552,10.233769,/d1/traffic/traf_000090,"Valley Path, Westside Heights",Westside Heights Botanical Garden,Westside Heights Downtown,,,,
traffic,traffic_000090,traf_000091,1,56.153474,10.241742,/d1/traffic/traf_000091,"Pine Rd, Westside Heights",Westside Heights Historic Market,Westside Heights Arts Quarter,,,,
traffic,traffic_000091,traf_000092,5,56.170869,10.187938,/d5/traffic/traf_000092,"Harbor Blvd, Lakeside District",Lakeside District Harbor Bridge,Lakeside District Industrial Zone,,,,
traffic,traffic_000092,traf_000093,7,56.19985,10.206276,/d7/traffic/traf_000093,"Tower Ln, Greenfield Park",Greenfield Park Waterfront Promenade,Greenfield Park Arts Quarter,,,,
traffic,traffic_000093,traf_000094,1,56.178173,10.246148,/d1/traffic/traf_000094,"Willow Way, Westside Heights",Westside Heights City Library,Westside Heights Downtown,,,,
traffic,traffic_000094,traf_000095,6,56.167762,10.175028,/d6/traffic/traf_000095,"Station Rd, Old Town Core",Old Town Core Central Plaza,Old Town Core Financial Row,,,,
traffic,traffic_000095,traf_000096,7,56.18415,10.222132,/d7/traffic/traf_000096,"Garden St, Greenfield Park",Greenfield Park Sports Arena,Greenfield Park Downtown,,,,
traffic,traffic_000096,traf_000097,5,56.147086,10.220012,/d5/traffic/traf_000097,"Elm St, Lakeside District",Lakeside District University Campus,Lakeside District Civic Center,,,,
traffic,traffic_000097,traf_000098,2,56.191377,10.154473,/d2/traffic/traf_000098,"King Blvd, Eastshore Quarter",Eastshore Quarter Cultural Center,Eastshore Quarter Uptown,,,,
traffic,traffic_000098,traf_000099,1,56.185587,10.248543,/d1/traffic/traf_000099,"Valley Path, Westside Heights",Westside Heights Historic Market,Westside Heights Industrial Zone,,,,
traffic,traffic_000099,traf_000100,7,56.180204,10.188723,/d7/traffic/traf_000100,"Queen Ave, Greenfield Park",Greenfield Park Shopping Mall,Greenfield Park Residential Block,,,,
traffic,traffic_000100,traf_000101,0,56.135546,10.216359,/d0/traffic/traf_000101,"Elm St, North Harbor",North Harbor City Hall,North Harbor Transit Hub,,,,
traffic,traffic_000101,traf_000102,1,56.149021,10.228349,/d1/traffic/traf_000102,"Garden St, Westside Heights",Westside Heights Central Plaza,Westside Heights Commercial Strip,,,,
traffic,traffic_000102,traf_000103,7,56.19182,10.211246,/d7/traffic/traf_000103,"Oak Ave, Greenfield Park",Greenfield Park Cathedral,Greenfield Park Uptown,,,,
traffic,traffic_000103,traf_000104,0,56.132456,10.193964,/d0/traffic/traf_000104,"Station Rd, North Harbor",North Harbor Convention Center,North Harbor Waterfront,,,,
traffic,traffic_000104,traf_000105,1,56.158852,10.24606,/d1/traffic/traf_000105,"Church Ln, Westside Heights",Westside Heights University Campus,Westside Heights Downtown,,,,
traffic,traffic_000105,traf_000106,5,56.143422,10.215747,/d5/traffic/traf_000106,"School St, Lakeside District",Lakeside District Riverside Park,Lakeside District Arts Quarter,,,,
traffic,traffic_000106,traf_000107,0,56.140016,10.194027,/d0/traffic/traf_000107,"Spruce St, North Harbor",North Harbor Convention Center,North Harbor Transit Hub,,,,
traffic,traffic_000107,traf_000108,3,56.121957,10.247513,/d3/traffic/traf_000108,"School St, South Hills",South Hills Cathedral,South Hills Uptown,,,,
traffic,traffic_000108,traf_000109,3,56.12087,10.223343,/d3/traffic/traf_000109,"Birch Dr, South Hills",South Hills Town Square,South Hills Industrial Zone,,,,
traffic,traffic_000109,traf_000110,0,56.137069,10.180186,/d0/traffic/traf_000110,"Summit Way, North Harbor",North Harbor Cultural Center,North Harbor Downtown,,,,
traffic,traffic_000110,traf_000111,1,56.172577,10.235827,/d1/traffic/traf_000111,"Spruce St, Westside Heights",Westside Heights Cultural Center,Westside Heights Uptown,,,,
traffic,traffic_000111,traf_000112,5,56.14273,10.187023,/d5/traffic/traf_000112,"Cedar Ln, Lakeside District",Lakeside District Clock Tower,Lakeside District Industrial Zone,,,,
traffic,traffic_000112,traf_000113,0,56.120648,10.186668,/d0/traffic/traf_000113,"Mill Rd, North Harbor",North Harbor City Library,North Harbor Downtown,,,,
traffic,traffic_000113,traf_000114,2,56.184075,10.15434,/d2/traffic/traf_000114,"Lake Dr, Eastshore Quarter",Eastshore Quarter Clock Tower,Eastshore Quarter Downtown,,,,
traffic,traffic_000114,traf_000115,4,56.13313,10.151573,/d4/traffic/traf_000115,"Bridge Ln, Midtown Center",Midtown Center Cultural Center,Midtown Center Civic Center,,,,
traffic,traffic_000115,traf_000116,3,56.138325,10.242562,/d3/traffic/traf_000116,"School St, South Hills",South Hills Waterfront Promenade,South Hills Transit Hub,,,,
traffic,traffic_000116,traf_000117,3,56.120195,10.240723,/d3/traffic/traf_000117,"Station Rd, South Hills",South Hills City Hall,South Hills Civic Center,,,,
traffic,traffic_000117,traf_000118,6,56.150179,10.151939,/d6/traffic/traf_000118,"Lake Dr, Old Town Core",Old Town Core Main Station,Old Town Core Commercial Strip,,,,
traffic,traffic_000118,traf_000119,0,56.132358,10.21778,/d0/traffic/traf_000119,"Forest Ave, North Harbor",North Harbor Lighthouse,North Harbor Uptown,,,,
traffic,traffic_000119,traf_000120,3,56.138745,10.241568,/d3/traffic/traf_000120,"Elm St, South Hills",South Hills Cultural Center,South Hills Arts Quarter,,,,
traffic,traffic_000120,traf_000121,1,56.144611,10.248021,/d1/traffic/traf_000121,"Garden St, Westside Heights",Westside Heights Art Museum,Westside Heights Commercial Strip,,,,
traffic,traffic_000121,traf_000122,5,56.175895,10.189165,/d5/traffic/traf_000122,"Spruce St, Lakeside District",Lakeside District Harbor Bridge,Lakeside District Commercial Strip,,,,
traffic,traffic_000122,traf_000123,7,56.181248,10.206135,/d7/traffic/traf_000123,"Birch Dr, Greenfield Park",Greenfield Park Historic Market,Greenfield Park Residential Block,,,,
traffic,traffic_000123,traf_000124,5,56.171683,10.218221,/d5/traffic/traf_000124,"Castle Rd, Lakeside District",Lakeside District Cathedral,Lakeside District Commercial Strip,,,,
traffic,traffic_000124,traf_000125,1,56.159405,10.223486,/d1/traffic/traf_000125,"Maple Blvd, Westside Heights",Westside Heights Botanical Garden,Westside Heights Waterfront,,,,
traffic,traffic_000125,traf_000126,5,56.156628,10.197759,/d5/traffic/traf_000126,"Queen Ave, Lakeside District",Lakeside District Cultural Center,Lakeside District Arts Quarter,,,,
traffic,traffic_000126,traf_000127,5,56.162845,10.188198,/d5/traffic/traf_000127,"Bridge Ln, Lakeside District",Lakeside District Art Museum,Lakeside District Residential Block,,,,
traffic,traffic_000127,traf_000128,7,56.187208,10.183373,/d7/traffic/traf_000128,"Mill Rd, Greenfield Park",Greenfield Park Riverside Park,Greenfield Park Waterfront,,,,
traffic,traffic_000128,traf_000129,4,56.128108,10.162515,/d4/traffic/traf_000129,"River Rd, Midtown Center",Midtown Center Science Center,Midtown Center Residential Block,,,,
traffic,traffic_000129,traf_000130,3,56.139079,10.238048,/d3/traffic/traf_000130,"Harbor Blvd, South Hills",South Hills Science Center,South Hills Industrial Zone,,,,
traffic,traffic_000130,traf_000131,0,56.138818,10.209004,/d0/traffic/traf_000131,"Birch Dr, North Harbor",North Harbor University Campus,North Harbor Downtown,,,,
traffic,traffic_000131,traf_000132,1,56.146221,10.237476,/d1/traffic/traf_000132,"Harbor Blvd, Westside Heights",Westside Heights Central Plaza,Westside Heights Financial Row,,,,
traffic,traffic_000132,traf_000133,2,56.181168,10.174912,/d2/traffic/traf_000133,"Mill Rd, Eastshore Quarter",Eastshore Quarter Town Square,Eastshore Quarter Downtown,,,,
traffic,traffic_000133,traf_000134,3,56.123913,10.23422,/d3/traffic/traf_000134,"Forest Ave, South Hills",South Hills City Hall,South Hills Transit Hub,,,,
traffic,traffic_000134,traf_000135,1,56.154326,10.230179,/d1/traffic/traf_000135,"Valley Path, Westside Heights",Westside Heights Botanical Garden,Westside Heights Financial Row,,,,
traffic,traffic_000135,traf_000136,1,56.150143,10.233294,/d1/traffic/traf_000136,"Lake Dr, Westside Heights",Westside Heights Cathedral,Westside Heights Residential Block,,,,
traffic,traffic_000136,traf_000137,1,56.166784,10.229489,/d1/traffic/traf_000137,"Station Rd, Westside Heights",Westside Heights Central Plaza,Westside Heights Industrial Zone,,,,
traffic,traffic_000137,traf_000138,7,56.199629,10.22149,/d7/traffic/traf_000138,"Garden St, Greenfield Park",Greenfield Park Cathedral,Greenfield Park Arts Quarter,,,,
traffic,traffic_000138,traf_000139,2,56.179428,10.169709,/d2/traffic/traf_000139,"Spruce St, Eastshore Quarter",Eastshore Quarter Art Museum,Eastshore Quarter Downtown,,,,
traffic,traffic_000139,traf_000140,5,56.176768,10.21058,/d5/traffic/traf_000140,"Spruce St, Lakeside District",Lakeside District Shopping Mall,Lakeside District Civic Center,,,,
traffic,traffic_000140,traf_000141,2,56.185481,10.153584,/d2/traffic/traf_000141,"Oak Ave, Eastshore Quarter",Eastshore Quarter Town Square,Eastshore Quarter Commercial Strip,,,,
traffic,traffic_000141,traf_000142,0,56.134787,10.218034,/d0/traffic/traf_000142,"Lake Dr, North Harbor",North Harbor Historic Market,North Harbor Arts Quarter,,,,
traffic,traffic_000142,traf_000143,1,56.171628,10.241903,/d1/traffic/traf_000143,"Mill Rd, Westside Heights",Westside Heights Cathedral,Westside Heights Civic Center,,,,
traffic,traffic_000143,traf_000144,7,56.184963,10.196148,/d7/traffic/traf_000144,"Pine Rd, Greenfield Park",Greenfield Park Clock Tower,Greenfield Park Industrial Zone,,,,
traffic,traffic_000144,traf_000145,1,56.172826,10.238673,/d1/traffic/traf_000145,"Cherry Ln, Westside Heights",Westside Heights Art Museum,Westside Heights Downtown,,,,
traffic,traffic_000145,traf_000146,6,56.14317,10.152709,/d6/traffic/traf_000146,"Harbor Blvd, Old Town Core",Old Town Core Sports Arena,Old Town Core Civic Center,,,,
traffic,traffic_000146,traf_000147,6,56.147935,10.152622,/d6/traffic/traf_000147,"Tower Ln, Old Town Core",Old Town Core Waterfront Promenade,Old Town Core Commercial Strip,,,,
traffic,traffic_000147,traf_000148,1,56.155157,10.23123,/d1/traffic/traf_000148,"Willow Way, Westside Heights",Westside Heights Shopping Mall,Westside Heights Uptown,,,,
traffic,traffic_000148,traf_000149,3,56.123739,10.236366,/d3/traffic/traf_000149,"Lake Dr, South Hills",South Hills Shopping Mall,South Hills Uptown,,,,
traffic,traffic_000149,traf_000150,7,56.188122,10.191163,/d7/traffic/traf_000150,"School St, Greenfield Park",Greenfield Park Town Square,Greenfield Park Financial Row,,,,
traffic,traffic_000150,traf_000151,7,56.184006,10.183022,/d7/traffic/traf_000151,"Lake Dr, Greenfield Park",Greenfield Park Shopping Mall,Greenfield Park Financial Row,,,,
traffic,traffic_000151,traf_000152,1,56.146394,10.246655,/d1/traffic/traf_000152,"Market Rd, Westside Heights",Westside Heights University Campus,Westside Heights Transit Hub,,,,
traffic,traffic_000152,traf_000153,3,56.129974,10.229396,/d3/traffic/traf_000153,"River Rd, South Hills",South Hills Science Center,South Hills Industrial Zone,,,,
traffic,traffic_000153,traf_000154,7,56.194388,10.186753,/d7/traffic/traf_000154,"Station Rd, Greenfield Park",Greenfield Park Convention Center,Greenfield Park Waterfront,,,,
traffic,traffic_000154,traf_000155,0,56.133225,10.182555,/d0/traffic/traf_000155,"Market Rd, North Harbor",North Harbor Historic Market,North Harbor Downtown,,,,
traffic,traffic_000155,traf_000156,3,56.12268,10.226912,/d3/traffic/traf_000156,"Castle Rd, South Hills",South Hills Convention Center,South Hills Arts Quarter,,,,
traffic,traffic_000156,traf_000157,4,56.121773,10.174771,/d4/traffic/traf_000157,"Pine Rd, Midtown Center",Midtown Center Main Station,Midtown Center Residential Block,,,,
traffic,traffic_000157,traf_000158,5,56.150027,10.188585,/d5/traffic/traf_000158,"Lake Dr, Lakeside District",Lakeside District Town Square,Lakeside District Transit Hub,,,,
traffic,traffic_000158,traf_000159,6,56.167879,10.173725,/d6/traffic/traf_000159,"Harbor Blvd, Old Town Core",Old Town Core Art Museum,Old Town Core Downtown,,,,
traffic,traffic_000159,traf_000160,6,56.157951,10.151374,/d6/traffic/traf_000160,"Forest Ave, Old Town Core",Old Town Core Cathedral,Old Town Core Civic Center,,,,
traffic,traffic_000160,traf_000161,7,56.189735,10.184072,/d7/traffic/traf_000161,"Willow Way, Greenfield Park",Greenfield Park Main Station,Greenfield Park Industrial Zone,,,,
traffic,traffic_000161,traf_000162,5,56.176936,10.20737,/d5/traffic/traf_000162,"Forest Ave, Lakeside District",Lakeside District City Library,Lakeside District Transit Hub,,,,
traffic,traffic_000162,traf_000163,2,56.178187,10.15011,/d2/traffic/traf_000163,"Market Rd, Eastshore Quarter",Eastshore Quarter Clock Tower,Eastshore Quarter Industrial Zone,,,,
traffic,traffic_000163,traf_000164,7,56.195561,10.208698,/d7/traffic/traf_000164,"River Rd, Greenfield Park",Greenfield Park Science Center,Greenfield Park Industrial Zone,,,,
traffic,traffic_000164,traf_000165,6,56.149909,10.172083,/d6/traffic/traf_000165,"Queen Ave, Old Town Core",Old Town Core Science Center,Old Town Core Transit Hub,,,,
traffic,traffic_000165,traf_000166,2,56.178787,10.153327,/d2/traffic/traf_000166,"Willow Way, Eastshore Quarter",Eastshore Quarter Main Station,Eastshore Quarter Waterfront,,,,
traffic,traffic_000166,traf_000167,4,56.14192,10.172918,/d4/traffic/traf_000167,"Bridge Ln, Midtown Center",Midtown Center Waterfront Promenade,Midtown Center Financial Row,,,,
traffic,traffic_000167,traf_000168,6,56.152412,10.157314,/d6/traffic/traf_000168,"Valley Path, Old Town Core",Old Town Core Science Center,Old Town Core Waterfront,,,,
traffic,traffic_000168,traf_000169,6,56.14911,10.152586,/d6/traffic/traf_000169,"Canal St, Old Town Core",Old Town Core Convention Center,Old Town Core Downtown,,,,
traffic,traffic_000169,traf_000170,0,56.13922,10.178854,/d0/traffic/traf_000170,"Spruce St, North Harbor",North Harbor Main Station,North Harbor Uptown,,,,
traffic,traffic_000170,traf_000171,4,56.120581,10.152364,/d4/traffic/traf_000171,"Park Rd, Midtown Center",Midtown Center City Library,Midtown Center Commercial Strip,,,,
traffic,traffic_000171,traf_000172,6,56.14477,10.169702,/d6/traffic/traf_000172,"King Blvd, Old Town Core",Old Town Core Town Square,Old Town Core Industrial Zone,,,,
traffic,traffic_000172,traf_000173,5,56.175198,10.182437,/d5/traffic/traf_000173,"Elm St, Lakeside District",Lakeside District Waterfront Promenade,Lakeside District Waterfront,,,,
traffic,traffic_000173,traf_000174,6,56.163679,10.168276,/d6/traffic/traf_000174,"Forest Ave, Old Town Core",Old Town Core Sports Arena,Old Town Core Uptown,,,,
traffic,traffic_000174,traf_000175,7,56.196662,10.179045,/d7/traffic/traf_000175,"Pine Rd, Greenfield Park",Greenfield Park Science Center,Greenfield Park Residential Block,,,,
traffic,traffic_000175,traf_000176,1,56.154121,10.225277,/d1/traffic/traf_000176,"Queen Ave, Westside Heights",Westside Heights Town Square,Westside Heights Commercial Strip,,,,
traffic,traffic_000176,traf_000177,5,56.155619,10.181196,/d5/traffic/traf_000177,"Park Rd, Lakeside District",Lakeside District University Campus,Lakeside District Arts Quarter,,,,
traffic,traffic_000177,traf_000178,0,56.137676,10.221007,/d0/traffic/traf_000178,"Canal St, North Harbor",North Harbor Lighthouse,North Harbor Uptown,,,,
traffic,traffic_000178,traf_000179,3,56.142132,10.223107,/d3/traffic/traf_000179,"Bridge Ln, South Hills",South Hills Cathedral,South Hills Downtown,,,,
traffic,traffic_000179,traf_000180,0,56.131513,10.186257,/d0/traffic/traf_000180,"Pine Rd, North Harbor",North Harbor Riverside Park,North Harbor Arts Quarter,,,,
traffic,traffic_000180,traf_000181,2,56.190036,10.159455,/d2/traffic/traf_000181,"Garden St, Eastshore Quarter",Eastshore Quarter Art Museum,Eastshore Quarter Residential Block,,,,
traffic,traffic_000181,traf_000182,7,56.196344,10.231362,/d7/traffic/traf_000182,"King Blvd, Greenfield Park",Greenfield Park Central Plaza,Greenfield Park Commercial Strip,,,,
traffic,traffic_000182,traf_000183,3,56.139982,10.234321,/d3/traffic/traf_000183,"Gate St, South Hills",South Hills Waterfront Promenade,South Hills Arts Quarter,,,,
traffic,traffic_000183,traf_000184,7,56.188988,10.17845,/d7/traffic/traf_000184,"Church Ln, Greenfield Park",Greenfield Park Riverside Park,Greenfield Park Financial Row,,,,
traffic,traffic_000184,traf_000185,4,56.137264,10.15223,/d4/traffic/traf_000185,"Canal St, Midtown Center",Midtown Center University Campus,Midtown Center Transit Hub,,,,
traffic,traffic_000185,traf_000186,0,56.128727,10.180455,/d0/traffic/traf_000186,"Forest Ave, North Harbor",North Harbor Shopping Mall,North Harbor Civic Center,,,,
traffic,traffic_000186,traf_000187,5,56.160276,10.197455,/d5/traffic/traf_000187,"Canal St, Lakeside District",Lakeside District Riverside Park,Lakeside District Financial Row,,,,
traffic,traffic_000187,traf_000188,1,56.183691,10.249577,/d1/traffic/traf_000188,"Cedar Ln, Westside Heights",Westside Heights Shopping Mall,Westside Heights Civic Center,,,,
traffic,traffic_000188,traf_000189,7,56.181805,10.193545,/d7/traffic/traf_000189,"Castle Rd, Greenfield Park",Greenfield Park Main Station,Greenfield Park Uptown,,,,
traffic,traffic_000189,traf_000190,3,56.131983,10.230548,/d3/traffic/traf_000190,"Summit Way, South Hills",South Hills Sports Arena,South Hills Financial Row,,,,
traffic,traffic_000190,traf_000191,5,56.142717,10.220445,/d5/traffic/traf_000191,"River Rd, Lakeside District",Lakeside District Waterfront Promenade,Lakeside District Residential Block,,,,
traffic,traffic_000191,traf_000192,5,56.164917,10.184798,/d5/traffic/traf_000192,"Forest Ave, Lakeside District",Lakeside District City Hall,Lakeside District Residential Block,,,,
traffic,traffic_000192,traf_000193,5,56.174807,10.21498,/d5/traffic/traf_000193,"Cherry Ln, Lakeside District",Lakeside District University Campus,Lakeside District Arts Quarter,,,,
traffic,traffic_000193,traf_000194,2,56.189708,10.156505,/d2/traffic/traf_000194,"Harbor Blvd, Eastshore Quarter",Eastshore Quarter Science Center,Eastshore Quarter Downtown,,,,
traffic,traffic_000194,traf_000195,5,56.16173,10.197475,/d5/traffic/traf_000195,"Tower Ln, Lakeside District",Lakeside District Waterfront Promenade,Lakeside District Uptown,,,,
traffic,traffic_000195,traf_000196,7,56.184871,10.213754,/d7/traffic/traf_000196,"Park Rd, Greenfield Park",Greenfield Park Waterfront Promenade,Greenfield Park Financial Row,,,,
traffic,traffic_000196,traf_000197,1,56.14665,10.227902,/d1/traffic/traf_000197,"Station Rd, Westside Heights",Westside Heights Riverside Park,Westside Heights Financial Row,,,,
